{
  "schema": "camerasource/camera-intrinsics",
  "version": 1,
  "calibrationId": "calibration-1",
  "cameraId": "camera-1",
  "cameraModel": "pinhole",
  "imageWidth": 800,
  "imageHeight": 600,
  "imageState": "raw",
  "intrinsicMatrix": [700, 0, 400, 0, 700, 300, 0, 0, 1],
  "distortionModel": "opencv-plumb-bob",
  "distortionCoefficients": [0.01, -0.02, 0, 0, 0],
  "quality": {"sampleCount": 8, "reprojectionErrorPx": 0.75},
  "calibratedAt": "2026-09-13T12:00:00.000Z"
}
